title,company,date,link,description
Analyst (Global Data and Analytics),Circle K,2024-08-15,https://www.linkedin.com/jobs/view/analyst-global-data-and-analytics-at-circle-k-3966711167?position=1&pageNum=0&refId=WBUu%2B%2FY%2BtwXXDjxB7N8HaQ%3D%3D&trackingId=5bu3DvWM3BIHpb7XqVnzKg%3D%3D&trk=public_jobs_jserp-result_search-card,"Job Summary

As a member of the Global Analytics & Insights Team, Analyst is an everyday partner of multiple departments, including Global Marketing, Category Management, Shared Services & Finance, Global Technology, and Business Unit Leadership.

The Analyst is responsible for completing analytical and operational inquiries by developing thoughtful, and thorough practical analyses and reports to inform decisions and support business needs. Results must be highly polished and suitable for internal and external presentation. The Analyst to the Manager of Analytics.

Responsibilities/Accountabilities


Analyze sales & marketing programs and transactional customer data to identify causal relationships between sales & marketing initiatives and both store and customer profitability; perform ROI analysis that assists in optimizing marketing spend.
Conduct operational analyses in the areas of marketing, merchandising, food & beverage, and other areas of the business as needed.
Analyze in-market strategic initiatives and business performance using test and control analytics, benchmarking, statistical concepts, and financial measures to guide decision making by brand and sales teams.
Work closely with senior marketing and merchandising executives, category managers and Business Unit Leadership to enhance business performance.
Constructively challenge the status quo to advance and evolve how Circle K thinks about, and executes Pricing and Promotions, given internal and external / environmental trends.
Generate ad-hoc reporting and analysis as required.
Other duties as assigned.


Knowledge, Skills And Other Qualifications Required


Intermediate skill level with enterprise reporting systems and relational database management systems preferred.
Knowledge of SQL programming fundamentals and statistical analysis tools preferred.
Proficient in all Microsoft Office applications.
Able to learn and utilize additional analytics tools (e.g., R, Python, Microsoft Power BI, etc.) as needed.
Experience with Business Intelligence software, general ledger and point of sale applications preferred.


Education/Training Required


Bachelor’s degree required, preferably with quantitative focus (Economics, Finance, Math, Stats, Analytics)


Circle K is an Equal Opportunity Employer.

The Company complies with the Americans with Disabilities Act (the ADA) and all state and local disability laws. Applicants with disabilities may be entitled to a reasonable accommodation under the terms of the ADA and certain state or local laws as long as it does not impose an undue hardship on the Company. Please inform the Company’s Human Resources Representative if you need assistance completing any forms or to otherwise participate in the application process.

Click below to review information about our company's use of the federal E-Verify program to check work eligibility:

In English

In Spanish


Show more "
SQL Data Analysts,Ledgent Technology,2024-07-22,https://www.linkedin.com/jobs/view/sql-data-analysts-at-ledgent-technology-3980064400?position=7&pageNum=0&refId=WBUu%2B%2FY%2BtwXXDjxB7N8HaQ%3D%3D&trackingId=C5ptyvSgAaZsn42OWNrzzA%3D%3D&trk=public_jobs_jserp-result_search-card,"SQL Data Analyst
Employment Type: Contract-to-Hire (1-3 months CTH)
Workplace Type: Onsite
Location: Mission Hills, CA (91345)
Industry: Construction/Equipment Rentals
Compensation: $42-48 hourly

DUTIES & RESPONSIBILITIES:

* Analyze and manipulate SQL data sets; test and debug issues with SQL reports; create and maintain SQL queries.
* Assist in the development of monthly reports and visual dashboards of customer data, including billings, revenue, and transactions for C-Level executives and the finance team.
* Manage, update, and maintain SQL databases.
* Utilize statistical programming languages to create automation scripts for analyzing and reporting data
* Extract, manipulate, and report data from financial and operations software systems.

REQUIREMENTS SKILLS:

* Bachelor's or Associate's Degree in Data Analytics, Computer Science, Software Engineering, or related fields (Preferred)
* 3-5+ years of experience working in a Data Analyst role working in a fast-paced environment analyzing and reporting SQL data.
* Ability to read, interpret, and created moderate to complete SQL query scripts.
* Knowledge and expeirnece with SQL Server Reporting Services (SSRS)
* Experiences using PowerBI or similar data visualization tools.
* Familiarity Python scripting for data automation purposes
* Strong skills with Microsoft Excel and experience using Pivot Tables and Formulas
* Experience extracting, manipulation, and reporting data information from financial and operations systems.

BONUS SKILLS:

* Certifications with SQL, Oracle, and Data Analytics
* Experience and knowledge of Oracle databases and PL/SQL scripting.
* Knowledge of Asset & Inventory Management and Sales/Rental Contract Management Software; familiarity with Basis Software is a huge plus!
* Familiarity with Adobe products


All qualified applicants will receive consideration for employment without regard to race, color, national origin, age, ancestry, religion, sex, sexual orientation, gender identity, gender expression, marital status, disability, medical condition, genetic information, pregnancy, or military or veteran status. We consider all qualified applicants, including those with criminal histories, in a manner consistent with state and local laws, including the City of Los Angeles' Fair Chance Initiative for Hiring Ordinance.

Show more "
Data Analyst,DC Department of Human Resources,2024-08-14,https://www.linkedin.com/jobs/view/data-analyst-at-dc-department-of-human-resources-4000946314?position=9&pageNum=0&refId=WBUu%2B%2FY%2BtwXXDjxB7N8HaQ%3D%3D&trackingId=2BmFgrvT%2B8HkJkYxJdR9Fw%3D%3D&trk=public_jobs_jserp-result_search-card,"We are excited in your interest to join DC Health (The District of Columbia Department of Health), a nationally accredited Public Health Department (https://phaboard.org/). DC Health is focused on providing the essential public health services (10 Essential Public Health Services) necessary to protect and promote the health of all people in all communities and remove systemic and structural barriers that have resulted in health inequities through the Core Competencies for Public Health Professionals (PH Core Competencies.)

Skills

Come see where your knowledge, skills and abilities are appreciated, developed, and rewarded as you play a vital role in DC Health achieving its Strategic Priorities:


Promote a culture of health and wellness
Address the social determinants of health
Strengthen public-private partnerships
Close the chasm between clinical medicine and public health and
Implement data driven and outcome-oriented approaches to program and policy development.


Bring your professional career to Washington, D.C., the most dynamic and diverse city in the country. With its proximity to major museums, world class parks, entertainment, and restaurants, increasing job opportunities and the seat of the federal government, the District of Columbia continues to be ranked in the top 10 of thriving city indicators where you can live, work and play. We look forward to reviewing your candidacy, be well and good luck!

Job Summary

This position is located in the District of Columbia Department of Health (DC Health), HIV/AIDS, Hepatitis, STD, and TB administration (HAHSTA). The functions of this position include analytical and programmatic work to the improvement of public health services through evidence-based practices. The incumbent will be responsible for assisting on the management, assessment, development, and implementation of public health programs. The desired candidate will also support local programs and agencies to achieve healthy communities, work with them to achieve health equity and eliminate health disparities with special focus on supporting populations with high risk health factors.

Major Duties And Responsibilities

The incumbent serves as Data Analyst (Data Manager) under the general supervision of the Planning and Evaluation Manager. The successful candidate will serve as an expert on the database management and analytics of Ryan White Services Program; provide professional technical assistance to healthcare providers to ensure data guidelines compliance as a means of improving overall clinical measures and patients outcomes.

The candidate will also interpret and analyze data and make decisions utilizing techniques and resources from external and internal partnerships. As Data Manager for the program, they will lead the planning and delivery of annual reporting, including the Ryan White Services Report and other reports to federal and local agencies. Additionally, the candidate will govern the data reporting processes through our data system (CAREWare) developing and updating data quality dashboards.

Qualifications And Education

Individuals must possess at least one (1) year of specialized experience must have been equivalent to at least the next lower grade (11) level in the normal line of progression for the occupation in the organization. Specialized experience is defined as experience that is typically in or related to the work of the position to be filled, and has equipped you with the particular knowledge, skills, and abilities to successfully perform the duties of the position, and that is typically in or related to the work of the position to be filled.

Its strongly preferred candidates hold a degree in Public Health, Data Analytics, Health Informatics or data/systems-relate subject.

Licenses and Certifications

None required.

Working Conditions / Environment

The incumbent must be able to carry out official duties in a variety of settings and conditions. Routine work will occur primarily in an office setting.

Other Significant Facts

Agency Wide Consideration: Qualified individuals that submit applications for this vacancy may be considered for other current open vacancies for which they qualify within DC Health.

Tour of Duty: Monday - Friday 8:15am - 4:45pm

Area of Consideration: Open to the Public

Promotion Potential: No Known Promotion Potential

Duration of Appointment: Career Service – Term Appointment: 13 Month time limited

Pay Plan, Series and Grade: CS-0301-12

Collective Bargaining Unit (Union): This position is covered in a collective bargaining unit, represented by Local AFGE 2978 .

Position Designation

This position has been designated as Security Sensitive. Pursuant to section 410 of Chapter 4 of the D.C. Personnel Regulations; in addition to the general suitability screening, individuals applying for or occupying security sensitive positions are subject to the following checks and tests:


(a) Criminal background check;
(b) Traffic record check (as applicable);
(c) Consumer credit check (as applicable);
(d) Reasonable suspicion drug and alcohol test; and
(e) Post-accident or incident drug and alcohol test.


EEO Statement: The District of Columbia Government is an Equal Opportunity Employer. All qualified candidates will receive consideration without regard to race, color, religion, national origin, sex, age, marital status, personal appearance, sexual orientation, family responsibilities, matriculation, physical handicap, or political affiliation.
Show more "
Data Analyst (Business Intelligence),Corcentric,2024-07-21,https://www.linkedin.com/jobs/view/data-analyst-business-intelligence-at-corcentric-3988421422?position=12&pageNum=0&refId=WBUu%2B%2FY%2BtwXXDjxB7N8HaQ%3D%3D&trackingId=knozlZx0v0RTnQ%2F8Ht8KvQ%3D%3D&trk=public_jobs_jserp-result_search-card,"As a Business Intelligence Analyst, you will join a driven, collaborative team within an ambitious, entrepreneurial global organization. You will work collaboratively within the Data & Analytics team supporting internal reporting for Global Client Services. This role requires a proactive individual who takes ownership of all assigned work and thrives in a collaborative team environment.

We pride ourselves on being a positive work environment, and place value on a work/life balance. This means thoughtful, sustainable workloads, as well as professional development opportunities to help you reach your career goals.

We are currently hiring out of the following office location(s):


Cherry Hill, NJ
Downers Grove, IL


This role may be eligible for voluntary work-from-home consideration. In order to be considered for this position, you should live within a commutable distance to one of these office locations, even if you plan to request a work-from-home arrangement, as there may be times when in-person meetings, training sessions, social events, or similar activities are held onsite.

This key position reports to the Director, Source-to-Pay Data & Analytics within our Advisory team. We're a dedicated, down-to-earth group in a growing organization offering plenty of opportunity. We look forward to adding you into the mix!

As a Business Intelligence Analyst, you will:


Handle diverse data inputs and transform them into valuable insights, demonstrating strong data organization and cleansing skills, ensuring that data is presented in a format that is clear and accessible to team members.
Utilize tools and techniques to clean and standardize data, ensuring accuracy and consistency.
Collaborate with cross-functional teams to understand business requirements and identify key outcomes for reporting.
Present findings and recommendations to stakeholders (technical and non-technical) in clear and concise formats
Demonstrate exceptional communication skills, documenting and articulating findings and action items



Requirements

You'll need to have:


Bachelor's or Master's in Mathematics, Statistics, Analytics, Business Information Systems, or a related field.
Proven experience with business intelligence software such as Power BI, Tableau, Qlik.
Excellent communication skills, written and verbal (English).
Knowledge in Programming Languages (SQL, Python) for querying and manipulating data stored in databases
Intermediate to advanced Microsoft Excel skills.
Strong analytical and problem-solving skills with a keen attention to detail and a commitment to delivering high quality reporting
A strong work ethic, self-motivation and progressive thinking, thriving on new challenges.
Ability to self-manage and prioritize workload across multiple projects.


(We want to make sure you're set up to succeed, and we view these as the critical skills you'll need to achieve great things at Corcentric!)

As we continue to grow our Advisory practice, we are looking for the right people to join us on our mission. If you are interested in being part of our team, we would like to communicate the following:


We are energized by challenges and the effort needed to solve them
We like working with people who are positive, adaptable and growth minded
We prioritize both the process and outcome of work, demonstrating a strong commitment to the success of our customers and colleagues. Exceptional quality work is an essential standard for us.
We operate within a voluntary work-from-home framework, yet we uphold the same level of accountability and responsibility as in a traditional office setting



About Us

Corcentric is a global provider of business spend management and revenue management software and services for mid-market and Fortune 1000 businesses. Corcentric delivers software, advisory services, and payments focused on reducing costs, optimizing working capital, and unlocking revenue.

We achieve success by exemplifying our core values in the way we work, communicate, and collaborate:


Do the Right Thing
Embrace + Drive Change
Be Empowered
Be Relentlessly Focused on the Customer



Benefits

At Corcentric, we know that the hard work of our employees is what drives the success of our organization. We care about who you are and what you value, both inside and outside of work.

Within our organization, you will have the opportunity to work with smart, collaborative team members and approachable leaders. Our down-to-earth, solutions-oriented culture means you'll have the opportunity to get hands-on with interesting work projects and be able to draw a short line from your contributions to business impacts. We prioritize professional development and encourage cross-functional promotional opportunities to enable you to reach your career goals. We have been in business for over 25 years and are thrilled to be actively growing and scaling our teams accordingly - it's an exciting environment and a great time to join.

We also recognize the importance of work-life balance and want to support your efforts to take care of your health and well-being and the health and well-being of those who depend upon you. In support of this, we are proud to offer a comprehensive benefits package to our full-time team members, including:


Generous annual paid time off program that increases with tenure
Nine paid holidays plus an annual personal holiday to recognize or celebrate an occasion that is important to you
An annual paid day off to volunteer for causes that are near and dear to you
Paid maternity, paternal/secondary caregiver, and adoptive parent leave
Company-paid life and disability insurance
401k program with a company match
Medical insurance plan options ranging from a traditional PPO to High Deductible Health Plan options that feature a company HSA contribution
Dental plan - including orthodontia coverage
Vision plan - including discount for LASIK surgery
All medical, dental, and vision insurance plans are available from the first of the month following your start date - no extended waiting period to be eligible!
A no-cost Employee Assistance Program - 24/7 access to confidential counseling services and a wide range of additional support and professional services


Our roles require routine use of standard office equipment, such as computers, keyboards, printers, phones, and filing cabinets. You may need to type, reach, and lift office materials of a reasonable weight. Travel may also be required based on job responsibilities and business needs.

Corcentric does not discriminate on the basis of race, sex, color, religion, age, national origin, marital status, disability, veteran status, genetic information, sexual orientation, gender identity or any other reason prohibited by law in provision of employment opportunities and benefits.
Show more "
Data Analyst,Inceed,2024-08-15,https://www.linkedin.com/jobs/view/data-analyst-at-inceed-3983180795?position=15&pageNum=0&refId=WBUu%2B%2FY%2BtwXXDjxB7N8HaQ%3D%3D&trackingId=CEYkpt20u1YvDlQkkYZIkQ%3D%3D&trk=public_jobs_jserp-result_search-card,"Compensation: $130k-160k/year

Location: Remote

Data Analyst:

Inceed has partnered with a great company to help find a skilled Data Analyst to join their team!

As a Data Analyst, you will be responsible for working closely with various business units, leveraging your analytical expertise to uncover insights, analyze problems, and develop data-driven solutions.

Responsibilities:


Data Analysis and Exploration:
Utilize strong SQL skills to extract, transform, and analyze data from diverse sources.
Perform exploratory data analysis to identify trends, patterns, and anomalies.
Interpret and communicate findings to both technical and non-technical stakeholders.
Statistical Analysis:
Apply fundamental statistical concepts to analyze and interpret data.
Design and conduct hypothesis testing and other statistical experiments.
Provide statistical insights to guide decision-making processes.
Collaboration with Business Units:
Work closely with business units to understand their data needs and challenges.
Collaborate with stakeholders to define analytical requirements and deliver actionable insights.
Translate business questions into analytical approaches and present findings effectively.
Problem Solving and Solution Development:
Analyze complex business problems and develop data-driven solutions.
Create and maintain dashboards, reports, and visualizations to facilitate decision-making.
Implement predictive models and machine learning algorithms as needed.

Required Qualifications & Experience:


achelor's degree in Statistics, Mathematics, Computer Science, or a related field.
Proven experience as a Data Analyst with a focus on SQL.
Strong understanding of statistical concepts and methodologies.
Excellent analytical and problem-solving skills.
Ability to communicate complex findings to both technical and non-technical audiences.


If you are interested in learning more about the Data Analyst opportunity, please submit your resume for consideration. Our client is unable to provide sponsorship at this time.

We are Inceed, a staffing and direct placement firm who believes in the possibility of something better. Our mission is simple: We’re here to help every person, whether client, candidate, or employee, find and secure what’s better for them.

Inceed is an equal opportunity employer. Inceed prohibits discrimination and harassment of any type and affords equal employment opportunities to employees and applicants without regard to race, color, religion, sex, sexual orientation, gender identity or expression, pregnancy, age, national origin, disability status, genetic information, protected veteran status, or any other characteristic protected by law.


Show more "
Data Analyst,"Mark Cuban Cost Plus Drug Company, PBC",2024-07-15,https://www.linkedin.com/jobs/view/data-analyst-at-mark-cuban-cost-plus-drug-company-pbc-3973355933?position=17&pageNum=0&refId=WBUu%2B%2FY%2BtwXXDjxB7N8HaQ%3D%3D&trackingId=7wiM55MRc1OHnr1SJmXxMQ%3D%3D&trk=public_jobs_jserp-result_search-card,"As a Data Analyst, you will be a key contributor to our mission of making affordable medications accessible to everyone. You will use your analytical skills and expertise to uncover valuable insights from complex datasets. These insights will directly guide our strategies, help us measure the impact of our initiatives, and ultimately improve patient affordability. This role is ideal for someone with a strong analytical mindset, technical skills, and the ability to translate complex data into clear recommendations.




DUTIES & RESPONSIBILITIES:

Data Cleaning and Preparation:

Collect, clean, and organize data from diverse sources.
Ensure data accuracy and completeness through validation.
Learn and apply data cleaning techniques to prepare data for analysis.




Data Analysis and Insights:

Assist in conducting analyses to identify trends, patterns, and key insights.
Support the creation of reports, dashboards, and visualizations that effectively communicate findings.
Translate complex data findings into actionable recommendations for stakeholders.




Data Quality:

Help identify and resolve data quality issues and discrepancies.
Learn about data quality standards and best practices in the healthcare industry.




Cross-Functional Collaboration:

Partner with various business units to support their data needs, including ad-hoc analysis and report generation.
Adapt your approach to meet the specific requirements of different teams.




Continuous Learning and Growth:

Actively participate in User Acceptance Testing (UAT) and System Testing to ensure data accuracy and system functionality.
Embrace opportunities to learn new skills and tools as our data landscape evolves.




EDUCATION AND/OR TRAINING:

Bachelor's degree in Statistics, Mathematics, Economics, Computer Science, or a related field.




WORK EXPERIENCE:

2+ years of experience in data analysis (healthcare or pharmaceutical experience is a plus).
Equivalent combination of education and industry experience will be considered.
“Power user” of Microsoft Excel or Google Sheets
Demonstrated ability to conduct ad hoc analyses under tight deadlines
Familiarity with SQL and data manipulation tools (Python or R is preferred)




ADDITIONAL QUALIFICATIONS:

Ability to work independently with little to no supervision.
Strong analytical and problem-solving skills
Passion for using data to answer questions and drive decisions
Meticulous attention to detail and commitment to data accuracy
Excellent communication and presentation skills
Enthusiasm for our mission of affordable medication access




Show more "
