title,company,date,link,description
SQL Data Analyst,Velocity Search Group,2024-06-12,https://www.linkedin.com/jobs/view/sql-data-analyst-at-velocity-search-group-3948809342?position=35&pageNum=0&refId=WBUu%2B%2FY%2BtwXXDjxB7N8HaQ%3D%3D&trackingId=t9%2BGtyx91b5zjIctSbu4gg%3D%3D&trk=public_jobs_jserp-result_search-card,"Our client a leading asset management firm, located in New York City is looking to hire a SQL Data Analyst. As a Data Analyst, your primary focus will be to develop and execute a comprehensive data strategy, establish robust data governance practices, and ensure efficient reporting solutions within our organization. You will play a pivotal role in shaping the data landscape, enabling data-driven decision-making, and optimizing data assets to drive business success. You will also work closely with the business to understand their data requirements and deliver solutions to support their needs. This is a Full Time Position. Citizens and those authorized to work in the U.S. are encouraged to apply. We are unable to sponsor currently. Qualified candidates should send their resumes (Word Format) along with salary expectations to careers@velocitysgi.com .

MUST HAVE AZURE SSIS (AZURE SYNAPSE)

Responsibilities


Design and implement a forward-looking data strategy that aligns with the organization's business objectives, incorporating industry best practices and emerging data technologies.
Define and maintain a scalable, efficient, and flexible data architecture that accommodates diverse data sources and formats, while enabling seamless data integration and access. Work closely with business stakeholders to align architecture with their requirements.
Design and develop robust ETL (Extract, Transform, Load) processes to efficiently move, cleanse, and transform data from various sources into a central data repository, meeting business needs.
Implement and manage master data management solutions to ensure data consistency, accuracy, and reliability across the organization, in collaboration with various departments.
Collaborate with business stakeholders to define reporting requirements and deliver business intelligence and reporting solutions that provide actionable insights. Work closely with various departments to understand their reporting needs.
Establish data quality standards, conduct data profiling, and implement data quality improvement processes to maintain data integrity, with consideration for business-specific data quality requirements.
Create and maintain comprehensive documentation of data assets, data flows, and data definitions, making it accessible to relevant business teams.
Continuously assess emerging data technologies and tools to keep the organization up-to-date and competitive.
Design and implement databases to reflect new and existing business requirements.
Evaluate current data designs and databases to determine needed, upgrades and improvements.
Design and automate various internal and external reports using SSRS, InDesign and Power BI.
Communicate with many different company stakeholders to assess needs and goals.
Interpret functional and business requirements, design and implement solutions and architecture suited to our current business model and enhance them.


QUALIFICATIONS


Bachelor's or Master's degree in Computer Science, Data Science, Information Systems, or a related field.
2+ years working experience in IT at Financial Institutions.
3+ years full stack development of enterprise applications and database solutions.
Hands on experience with SQL Server, Azure, SSRS, Power BI.
Experience in data architecture, data strategy, data governance, and reporting.
In-depth knowledge of database management systems, data modeling, ETL processes, and reporting tools
Excellent communication and interpersonal skills for collaboration with cross-functional teams and stakeholders
Knowledge of industry best practices and data management trends
Skills and Abilities:
Knowledge of business domain is recommended.
Proficiency in Azure data services and technologies.
Strong understanding of data architecture, data modeling, and data governance principles.
Knowledge of ETL processes and tools, particularly within the Azure ecosystem.
Experience with master data management (MDM) and data quality management.
Expertise in data reporting and analytics tools, especially those integrated with Azure.
In-depth knowledge of data security and compliance, including Azure security practices.
Excellent documentation and communication skills.
Expertise in T-SQL and SQL Server Data Management Services (SSMS), SQL Server Integration Services (SSIS), SQL Server Reporting Services (SSRS)Solid knowledge of T-SQL (SQL Server) which includes stored procedures, UDF's and query optimization.
Solid knowledge of ETL, SSRS and Power BI.
Experience in T-SQL, SSRS, Power BI and SQL Server database management system.
Good understanding of Azure environment and DevOps.
InDesign Automation a plus.


Salary 100-120k
Show more "
Data Analyst,Bikky,2024-08-14,https://www.linkedin.com/jobs/view/data-analyst-at-bikky-4001482599?position=38&pageNum=0&refId=WBUu%2B%2FY%2BtwXXDjxB7N8HaQ%3D%3D&trackingId=QMHe5%2FlK0%2BtHYqrZkEc63A%3D%3D&trk=public_jobs_jserp-result_search-card,"About Bikky




Restaurants are the heart of our communities - where we go to celebrate life’s memorable moments with those we love, and find comfort and familiarity in the world. But while the digital and data revolutions have transformed other parts of commerce and hospitality, restaurants haven’t had the same opportunity. The result has been an industry that’s - on average - had their profit margins shrink by 5x over the past 20 years.




Bikky was founded on the belief that restaurants deserve the same access to data as the largest, most sophisticated businesses in the world. We believe that data can fundamentally transform the economic model of the entire restaurant industry - producing better businesses, more jobs, and stronger communities.




Bikky is based in New York City and has raised over $15 million in funding to date, most recently with a Series A in Q4 2023. We’re proud to serve thousands of restaurant locations across the U.S., including major brands like Bojangles, MOD Pizza, Dave’s Hot Chicken, and Long John Silver’s. 




About the role




As a Data Analyst, you’ll act as the bridge between our customers and our product. You’ll support customers through their journey adopting Bikky - starting from onboarding their data all the way to leveraging it for sophisticated analyses. You’ll be a key stakeholder in making sure that our customers understand Bikky’s insights and that we become a core part of their critical decision making processes. Unlike data roles that focus on internal analyses, at Bikky you’ll work across the entire restaurant industry - helping brands use their data to solve their hardest business challenges. 




From a technical perspective, you’ll have the opportunity to contribute throughout our entire data stack. A typical day might include everything from updating a DBT model to support a new customer’s needs, to performing an analysis on customer retention. You'll collaborate closely with our product and engineering teams to refine and enhance our data tools based on real-world customer feedback. Long term, there’s an opportunity to grow into a product development, data engineering, or data science role depending on where you’d like to take your career. 




About you




Our data roles are unique; they’re product and customer facing, rather than internal facing. To meet that challenge, we’re looking for candidates with a multidisciplinary skillset. In our interview process we’ll look for analysis experience, business sense, and interpersonal skills.




The ideal candidate will have: 

1-3 years of experience working with data
Fluency in SQL, experience with DBT a bonus 
Experience in a business facing or customer facing analytical role 
Strong statistical skills
Excellent verbal and written communication




This is a great role for candidates early in their careers or transitioning into data from a business role. That said, we want to talk with exceptional candidates from any background. If you feel you’re a great fit for the role, please reach out even if you don’t meet all of the points above. 




Why us




At Bikky, you’ll work on challenging problems that matter to real businesses while tackling industry leading technical challenges. Our DBT + Snowflake implementation is in the top ~1% of industry-wide sophistication and we grapple with novel data engineering, analytical, and product problems every day. Alongside challenging work, you’ll have the support of a fully Senior and Staff level team. You’ll be the first non-senior level hire and we’re deeply committed to making sure you’ll be successful. You’ll have the opportunity to accelerate your career by working alongside some of the best in the industry. 




Perks and Benefits

$100,000 - $140,000 annual salary 
Generous equity compensation
Top tier (for stage) health insurance including medical, vision, and dental 
Ability to participate in a 401k
Bikky offers a hybrid working environment. For candidates in New York City, we have an office where teammates can opt to work 2-3 times per week.
Flexible vacation policy
Show more "
Data Analyst,EnableComp,2024-08-03,https://www.linkedin.com/jobs/view/data-analyst-at-enablecomp-3991164330?position=41&pageNum=0&refId=WBUu%2B%2FY%2BtwXXDjxB7N8HaQ%3D%3D&trackingId=R2iirogkHlMPNxCiB7qIvw%3D%3D&trk=public_jobs_jserp-result_search-card,"Recognized as a 2024 Top Workplace by the Tennessean, EnableComp is the leading source of revenue cycle management solutions for complex claims in the US. We proudly partner with well over 1000+ hospitals across the US to help them maximize their revenue from complex claims.

Our Mission

We partner with healthcare providers to maximize reimbursement from complex claims payers by having the best people, processes, products and performance.

Our Vision

We enable healthcare providers to do what they do best.

Position Summary

The Data Analyst responsibilities will include but not limited to quantitative analysis and predictive modeling of healthcare data to provide management with statistical findings and conclusions.  The ideal candidate should be able to develop, collect and analyze metrics and data to formulate fact-based decisions and proactively implement process improvements through analysis of claim and operational data.




Key Responsibilities
Ability to transform complex datasets into executive-level summaries, and communicate findings clearly and succinctly
Managing multiple projects and deadlines so you will need excellent time management and prioritization skills to meet multiple deadlines
Demonstrated problem solving and critical thinking skills; strong understanding of analytics results, as well as the ability to identify a problem and develop and execute new solutions to obtain results
Effectively communicate results to key stakeholders and policy makers; communication of results include clean and well-organized presentations to reflect analytic methods used and to illustrate key decision points with sufficient detail to support comprehension and replication of the analysis
Data responsibilities include identifying necessary data elements to build measures, querying data to limit large data sets, joining tables to build analytic views, other data prep, and documentation of process and results; working with external data management team to receive, load, and analyze new data
Ability to communicate with BA and IT to understand requirements, socialize ideas among peers and document work product
Solid hands-on experience and knowledge of database concepts
Ability to work independently given minimal direction
Exceptional attention to detail and work product validation, as well as the ability to step back and see the big picture
Other duties as required




Requirements and Qualifications
Bachelor’s Degree
2+ years’ experience with analytics, reporting, and relational databases
2 years’ experience working in a healthcare, SaaS or other similar environment.
Expertise in Microsoft Excel, PowerPoint, and SQL Server
Familiarity with healthcare terminology such as diagnosis code, CPT, claim ID, DRG, inpatient, outpatient, etc.
Experience with BI tool (Power BI/Tableau/Qlik)
Experience with statistical models and predictive analytics
Equivalent combination of education and experience will be considered.
Must have strong computer proficiency and understand how to use basic office applications, including MS Office (Word, Excel, and Outlook).
Regular and predictable attendance.
To perform this job successfully, an individual must be able to perform each essential duty satisfactorily.  Reasonable accommodations may be made to enable qualified individuals with disabilities to perform the essential functions.




Special Considerations and Prerequisites
Strong communication and presentation skills; ability to explain complex analytic results to an audience of varying levels of technical understanding required
Exceptional attention to detail and work product validation
Strong planning, organizational, and multi-tasking skills
Strong research, analytical, and problem-solving skills
Strong communication skills, written and verbal
Ownership of body of work







EnableComp is an Equal Opportunity Employer M/F/D/V. All applicants will be considered for this position based upon experience and knowledge, without regard to race, color, religion, national origin, sexual orientation, ancestry, marital, disabled or veteran status. We are committed to creating and maintaining a workforce environment that is free from any form of discrimination or harassment.

EnableComp recruits, develops and retains the industry's top talent.  As the employer of choice in the complex claims industry, EnableComp takes pride in our continuous commitment to building and maintaining a culture centered around fostering the professional growth and development of our people.  We believe that investing in our employees is the key to our success, and we are dedicated to providing them with the tools, resources, and support they need to thrive and grow their career here. At EnableComp, we are committed to living up to our core values each and every day, and we believe that this commitment is what sets us apart from other companies.  If you are looking for a company that values its employees and is dedicated to helping them achieve their full potential, then EnableComp is the place for you.

 Don’t just take our word for it!  Hear what our people are saying:

“I love my job because everyone shares the same vision and is determined and dedicated. People care about you as a person and your professional growth. There is a genuine spirit of cooperation and shared goals all revolving around helping each other.” – Revenue Specialist

“I enjoy working for EnableComp because of the Core Values we believe in. EnableComp stands true to these values from empowering employees to ecstatic clients. This company is family oriented and flexible, along with understanding the balance of work, life, and fun.” – Supervisor, Operations

Show more "
Data Analyst,HealthStream,2024-08-17,https://www.linkedin.com/jobs/view/data-analyst-at-healthstream-3985168556?position=44&pageNum=0&refId=WBUu%2B%2FY%2BtwXXDjxB7N8HaQ%3D%3D&trackingId=hTSYJecOh1XRr1Xd%2FHIjKw%3D%3D&trk=public_jobs_jserp-result_search-card,"Job Details

Job Location

USA Remote - Nashville, TN

Remote Type

Fully Remote

Position Type

Full Time

Travel Percentage

Negligible

Job Shift

Day

Job Category

Data Services

Description

Company Overview

HealthStream is the leader in healthcare workforce solutions. We help organizations work better by helping their people work smarter.

HealthStream provides the leading learning, clinical development, credentialing, and scheduling applications delivered on healthcare’s #1 platform. We streamline everyday tasks while improving performance, engagement, and safety – fostering a workplace where people flourish, and care thrives.

Why Join Us

At HealthStream, you’ll have the opportunity to make a meaningful impact on the future of healthcare by collaborating with a team of talented professionals dedicated to innovation and excellence. We offer competitive compensation, comprehensive benefits, and a supportive work environment where creativity and collaboration thrive.

Our shared vision is to enhance the quality of healthcare by empowering the people who deliver care – a commitment we have upheld for over 30 years through providing innovative solutions and driving constant growth. Join us in revolutionizing the healthcare industry and shaping the future of patient care. As a HealthStreamer, you will be at the forefront of healthcare technology innovation, making a recurring impact on the industry.

We’re proud of our values-forward culture that offers our people:


Mission-oriented work
Diverse and inclusive culture
Competitive Compensation & Bonuses
Comprehensive Insurance Plans
Mental and Physical Health Support
Work-from-home flexibility
Fitness Center Reimbursements
Streaming Good time off for volunteering
Wellness workshops
Buddy Program for new HealthStreamers
Collaborative work environment
Career growth opportunities
Continuous learning opportunities
Inspiring workspaces to collaborate and connect with other HealthStreamers
Free employee parking at our Resource Centers in Nashville, Boulder and San Diego


At HealthStream, our thriving culture encourages collaboration and values contributions, allowing our team members to continuously solve big problems and grow. We offer flexibility and paid time off to support work-life integration for all employees, including a hybrid work environment and Streaming Good volunteer day. For team members in commutable distance, HealthStream has Resource Centers in Nashville, TN, Boulder, CO, and San Diego, CA. Our resource centers provide an inspiring workspace to collaborate and recharge as well as company-sponsored onsite social events for development, connection, and celebration.

We are committed to driving innovation in healthcare and ensuring that patients receive competent care from qualified professionals. As a HealthStream team member, you will help bring this vision to life. If you want to work for a company committed to its values and vision, HealthStream is the place for you!

HealthStream is an equal opportunity employer. HealthStream prohibits employment practices that discriminate against individual employees or groups of employees on the basis of age, color, disability, national origin, race, religion, sex, sexual orientation, pregnancy, veteran or military status, genetic information or any other category deemed protected by state and/or federal law.

Position Information

Position Overview

The Data Analyst position will report to the Sr. Manager, Commerce Engineering and is responsible for maintaining critical HealthStream data. The Salesforce system houses critical contracting information such as Product data, Sales data, Account data, etc. The Data Analyst will work closely with Salesforce Admins, the Business Enablement Team, and a wide range of business units. This position will use a mixture of technical tools to perform manual updates, use automation and build reports while working with internal stakeholders to support functional and downstream reporting needs. The Data Analyst will provide support on various tasks, cases, and projects in the Salesforce platform. This position requires self-motivation, a strong analytical mindset, and the ability to work well with teams - strong communication and analytical skills are a must. The applicant must have a solid understanding of data analysis and software development concepts and technologies.

Key Responsibilities

You will be responsible for adhering to all HealthStream security policies, procedures, and assigned training.


Identify systemic and one-off errors in the data and implement corrections.
Build tools in SQL, Python, and Excel to efficiently automate complex data transformations and corrections
Work with Salesforce Admins to improve and streamline our quote-to-cash pipeline by enhancing our contracting system. Transform new data sets to conform to HealthStream standards before inserting them into the Salesforce system.
Process and correct new and historical data to address data completeness, consistency, conformity, accuracy, integrity, and timeliness.
Study current processes and be familiar with the various nuances in the data as result.
Understand and communicate the operational and reporting impact of any changes to the data.
Work with Operational teams to support their use and adoption of Salesforce toolsets which result in data quality.
Work with reporting stakeholders to assure they have appropriate views and access and consult on interpretation of the data.
Liaison between Sales, Legal, and Accounting to facilitate discovery to understand or correct unclear and unique contracts.


Qualifications

Requirements


Bachelor’s degree in Computer Science, Information Systems, or related discipline.
1 + years of experience with data extraction and transformation tools (Excel, Access, SQL)
1 + years of experience with Python (or similar)
Salesforce platform, admin, design experience preferred


Qualifications


Excellent communication skills written and verbal
Detailed analytical skills
Excellent interpersonal skills and technical aptitude
Ability to write, analyze, and develop SQL and Python code
Responsible for developing improved data processes to increase both the scope and accuracy of our records
A fundamental understanding of relational database theory.
Ability to work well on a team to offer and receive instruction
Ability to multi-task and pivot priorities
Ability to handle stress and maintain excellent customer service
Ability to lead, own, and drive a project to completion
Self-starter, high character, accountable, eager to serve, strives for excellence


Benefits

HealthStream offers a comprehensive benefits package to eligible employees, including:


Medical, Dental and Vision insurance
Paid Time Off
Parental Leave
401k and Roth
Flexible Spending Account
Health Savings Account
Life Insurance
Short- and Long-Term Disability
Medical Bridge Insurance
Critical Illness Insurance
Accident Insurance
Identity Protection
Legal Protection
Pet Insurance
Employee Assistance Program
Fitness Reimbursement


Are you passionate about enhancing healthcare outcomes and empowering healthcare professionals? Join the HealthStream team and become a HealthStreamer! Together, we can make a difference in the world of healthcare.
Show more "
