title,company,date,link,description
Data Analyst,Elder Research,2024-06-26,https://www.linkedin.com/jobs/view/data-analyst-at-elder-research-3960167369?position=45&pageNum=0&refId=WBUu%2B%2FY%2BtwXXDjxB7N8HaQ%3D%3D&trackingId=Hf634BfbPuGamzTxqifNCw%3D%3D&trk=public_jobs_jserp-result_search-card,"Northern Virginia / DC Metro Area

This role does require an active CBP BI.

People Centered. Data Driven

Elder Research Inc. is a Data Science consulting firm specialized in providing analytic solutions to clients in Commercial and Government industries. Providing analytic solutions to hundreds of companies across numerous industries, our team enjoys a great variety in the type of work they do and exposure to a wide range of techniques and tools.

We are trusted advisors to our clients, building lasting relationships and partnering as preferred analytics providers. We use a variety of programming languages and tools to create analytic solutions, often fitting within our clients’ environment and needs.

Join our team and find great opportunities to hone your analytic skills, work on complex problems with amazing teammates, and gain valuable analytics consulting experience.

Opportunity

Role

We are looking for talented and motivated employees that will play important roles on multi-discipline teams that will provide strategic level assistance, consultation, recommendations, and support to our customer in the areas of:


Workforce and succession planning where we will play a role developing strategic workforce plans and identifying and addressing gaps between the workforce of today and the workforce of tomorrow.
Data-driven strategy formulation and analytics support where we will assist with strategy formulation concerning resource planning, programming, budgeting, financial management, and mission execution activities.
Business transformation where we will perform analyses and provide recommendations to improve existing processes, capabilities, and mission execution and support functions.


Position Responsibilities

The Data Analyst will perform one or more of the following activities:


Develop or apply mathematical or statistical theory and methods to collect, organize, interpret, and summarize numerical data to provide usable information.
Responsible for the development of analytical solutions and databases. Develops specifications for the most efficient database solutions. Good working knowledge and hands-on experience with key software platform architectures, web servers, application servers, and relational databases. May evaluate new data sources for adherence to the organization's quality standards and ease of integration. Provide consultation on complex projects.
Assist in exploring, categorizing, and reviewing information. Inspect, clean, transform and model data with the goal of discovering useful information, informing conclusions and supporting CBP decision-making; ability to mine, review and validate data in order to develop models and data visualization that focus on predictive purposes and developing pertinent business information for CBP decision-makers. In addition, have the ability to create and manage dashboards. Be able to review database architecture and data control polices and offer recommendations for improvement and be able to support the existing development of an activity-based costing (ABC) model or development of new ABC models as required.


This role does require an active CBP BI.

About Elder Research, Inc

Elder Research is a fast growing consulting firm specializing in predictive analytics. Being in the data mining business over 20 years, we pride ourselves in our ability to find creative, cutting edge solutions to real-world problems. We work hard to provide the best value to our clients and allow each person to contribute their ideas and put their skills to use immediately.

Our team members are passionate, curious, life-long learners. We value humility, servant-leadership, teamwork, and integrity. We seek to serve our clients and our teammates to the best of our abilities. In keeping with our entrepreneurial spirit, we want candidates who are self-motivated with an innate curiosity and strong team work.

Elder Research believes in continuous learning; each week the entire company attends a “Tech Talk” followed by an office lunch. Elder Research provides a supportive work environment with established parental, bereavement, and PTO policies. By prioritizing a healthy work-life balance - with reasonable hours, solid pay, low travel, and extremely flexible time off - Elder Research enables and encourages its employees to serve others.

Elder Research, Inc. is an Equal Opportunity Employer. All qualified applicants will receive consideration for employment without regard to race, color, religion, sex, sexual orientation, gender identity, national origin, or protected veteran status and will not be discriminated against on the basis of disability.

Elder Research is a Government contractor and our positions require US Citizenship.
Show more "
Data & Analytics Analyst,Bridgestone Americas,2024-08-08,https://www.linkedin.com/jobs/view/data-analytics-analyst-at-bridgestone-americas-3993681466?position=54&pageNum=0&refId=WBUu%2B%2FY%2BtwXXDjxB7N8HaQ%3D%3D&trackingId=vpGHObmgP2lX6roLycHvqA%3D%3D&trk=public_jobs_jserp-result_search-card,"Company Overview

Wherever you work and whatever role you fill, when you represent the Bridgestone name you know that you are a valued teammate who is part of our larger mission to “Serve Society with Superior Quality.” We start by offering each teammate more than just a salary. We provide formal training, competitive performance incentives, paid vacation and holidays, healthcare packages for full-time and part-time employees, and a 401k plan to help build your future.

We believe people can only provide superior service and quality to others when they are allowed to bring their whole selves to work and know they are supported. We believe in championing all perspectives, individuals and teams because we understand the importance of seeing the world and our business through many different lenses. We are building a team as diverse as the world we serve. So, show us what you’re made of. Show us the smart stuff, the tough stuff, the bold, beautiful and brave stuff. Because who you are is what we need.

Bridgestone Americas, Inc. is headquartered in Nashville, Tennessee and is the U.S. subsidiary of Bridgestone Corporation headquartered in Japan. Bridgestone Americas and its subsidiaries develop, manufacture and market a wide range of Bridgestone, Firestone and associate brand products to address the needs of a broad range of customers and industries.

Job Category

Data & Analytics

Position Summary

Commercial Data & Analytics Analyst work includes: Analyzing business intelligence data to inform business and product decisions. Blending historical data from available industry reports, public information, field reports or purchased sources as input to analyses. Identifying and analyzing industry/geographic trends and competitor market strategies and monitoring current/potential customer trends.

Responsibilities



Collaborates with field sales to understand business challenges and opportunities and develops data solutions that meet the business intelligence or insights needs.
Creates and deploys business intelligence solutions (interactive analytic reports and dashboards) using visualization tools that lead to actionable insights.
Analyzes data, forming conclusions and recommendations, producing insights that will help shape effective strategies to achieve business outcomes.
Identifies critical data sources necessary to achieve desired business outcomes and collaborates with others across the organization to integrate data into a consistent and usable format.
Drives adoption of dashboards by providing consultation and training for end users.
Identifies & resolves data quality issues discovered during the business intelligence and insights process.



Minimum Qualifications



Bachelor’s degree in an analytical area such as MIS, Finance, or Business Analytics and 1-2 years of experience in reporting, analytics or business insights
Proficient in Tableau desktop or Alteryx or similar data blending tool
Excellent communication skills
Experience analyzing data to solve a wide variety of business problems.
Self-starter with strong time management and organizational skills
Able to work in ambiguous situations and respond flexibly to changing circumstances, priorities, and time constraints.
Team player with ability to collaborate with others.



Bridgestone is proud to be an Equal Employment Opportunity / Affirmative Action employer. It is our policy to consider for employment all individuals regardless of age, color, national origin, citizenship status, physical or mental disability, race, religion, gender, sex, sexual orientation, gender identity and/or expression, genetic information, veteran status, or any other characteristic protected by federal, state or local law.

Employment Eligibility

If hired, a Form I-9 Employment Eligibility Verification must be completed at the start of employment. Temporary work authorization or the need for sponsorship may disqualify you from employment.
Show more "
Data Analyst,Tata Consultancy Services,2024-08-01,https://www.linkedin.com/jobs/view/data-analyst-at-tata-consultancy-services-3969570249?position=55&pageNum=0&refId=WBUu%2B%2FY%2BtwXXDjxB7N8HaQ%3D%3D&trackingId=EUaTPOLrHIwE4wFNsNg8Rg%3D%3D&trk=public_jobs_jserp-result_search-card,"Analyze each business context and match with Apple IT infrastructure in terms of databases, data extraction, data processing and enrichment, data retention, reporting infrastructure and IT tools, which would be used to come up with a strategy to implement business needs.
Analyze business needs to formulate a system that meets the requirements of business.
Use Apple IT infrastructure and tools like ETL framework, Snowflake, Tableau, Python and ETL metadata setup to create and transform business requirements into technical specifications which covers scope, required process workflow, testing and scope for automation from development to implementation.
Analyze the impact on existing reporting layers and applications due to changes in source system data and addition or modification of source system functionality. Output from impact analysis will provide details on changes required in Services data extraction, data processing, reporting layer and ultimately on business reporting KPIs reported through GBI reporting UI like Royalty Approval UI, Tableau dashboards and direct reporting SQL queries used by business users.
Extract, clean and Analyze data using SQL, Python to identify patterns and trends on sales data for both prescriptive and predictive analysis
Develop and maintain data centric reports and dashboards in Tableau at both Static and Dynamic stages.
Apply advanced statistical methods to interpret data, generate reports and create presentations that convey findings to the stake holders
Develop and deploy automation scripts in SQL/Python to enhance efficiency in reporting work flows
Implem ent automation solutions to reduce manual effort, improve accuracy and accelerate business processes
Work closely with cross functional teams including Finance, Operations, Apple care, SAP to understand data requirements and flows to Reporting ESL’s
Troubleshoot data discrepancies and work with relevant teams to resolve issues proactively


Manage multiple projects simultaneously, prioritize tasks and meet deadlines, have documentation of process on par with the fast-paced environment.
Show more "
Analista de Dados,Shopper.com.br,2024-07-03,https://www.linkedin.com/jobs/view/analista-de-dados-at-shopper-com-br-3965029092?position=56&pageNum=0&refId=WBUu%2B%2FY%2BtwXXDjxB7N8HaQ%3D%3D&trackingId=icFm4T0dsfUfncILv5Nmzg%3D%3D&trk=public_jobs_jserp-result_search-card,"Job Description

Estamos procurando gente fora da curva, que queira construir um produto que seja referência na área de tecnologia.

Além do básico, alguém que consiga pensar o produto, agregar com novas ideias, sempre pensando na melhor solução para o cliente final.

Usamos tecnologia para automatizar o abastecimento da casa das pessoas. Nosso objetivo é criar um mundo onde os produtos essenciais cheguem na sua casa com a mesma facilidade que a água chega na torneira.

Com nosso modelo de compras planejadas já fizeram nossos clientes economizarem mais de 30 milhões. Mas nossa plataforma de recorrência é apenas o primeiro passo nesse caminho (ainda tem muitos produtos inovadores no forno).

E aí, o que achou? Vem fazer parte de um time onde você não será só mais 1!

Responsibilities and assignments


Analisar grandes conjuntos de dados para identificar padrões e tendências de compra;
Gerar insights acionáveis para otimizar estratégias de vendas e marketing;
Colaborar com as equipes de marketing e operações para implementar soluções baseadas em dados;
Monitorar o desempenho das estratégias e propor ajustes conforme necessário.


Requirements And Qualifications


Mentalidade data-driven com habilidades analíticas sólidas;
Domínio básico de programação em Python ou SQL para manipulação e análise de dados;
Conhecimento em ferramentas de Dataviz: Power BI, Tableau, Looker Studio e similares;
Conhecimento em Google Analytics;
Habilidade avançada em Excel para análise de dados e criação de relatórios;
Capacidade de comunicar insights complexos de forma clara e concisa;
Capacidade de trabalhar de forma autônoma e em equipe em um ambiente dinâmico;
Desejável: Pelo menos 1 ano de experiência no mercado de varejo, preferencialmente em análise de dados.
Desejável: Conhecimentos de índices e métricas de marketing como: LTV, RFV, Cohort, Growth, Fidelização, CAC, Retenção, ROI, etc.


Additional information


Vaga também para PCD.


Process stages


Step 1: Registration1Registration
Step 2: Teste de Lógica2Teste de Lógica
Step 3: Queremos te conhecer melhor!3Queremos te conhecer melhor!
Step 4: Queremos que você conheça a área!4Queremos que você conheça a área!
Step 5: Cultura Shopper5Cultura Shopper
Step 6: Hiring6Hiring


SOMOS MAIS QUE UM SUPERMERCADO!

Somos a startup que já economizou mais de R$ 30 milhões a milhares de brasileiros e dobra de tamanho a cada 3 meses, desde sua fundação (em 2015). Em 2021 conseguimos levantar cerca de R$300 milhões em duas rodadas de investimento com gente fora da curva, como José Galló (ex-CEO da Renner), GIC, Ariel Lambrecht (fundador da 99 e da Yellow), Minerva Foods, entre outros.

Acreditamos que um país melhor é feito de empresas mais eficientes e de pessoas que trocam velhos hábitos por escolhas mais inteligentes. E trabalhamos por isso. Por essa visão de país melhor, aplicada ao setor que atinge a todos os brasileiros: o setor de produtos essenciais de consumo, mais conhecido como ""setor supermercadista"".

Mas esqueça esse nome: ""supermercado"". Somos mais que isso. Somos um sistema de reabastecimento.

E queremos ser o maior e melhor sistema de reabastecimento do Brasil. Esse é nosso sonho.

""Um mundo onde os produtos essenciais cheguem na sua casa com a mesma facilidade que a água chega na torneira""

Quer participar desse sonho com a gente?
Show more "
Entry Level Data Analyst,Turn2Partners,2024-08-14,https://www.linkedin.com/jobs/view/entry-level-data-analyst-at-turn2partners-3999085502?position=60&pageNum=0&refId=WBUu%2B%2FY%2BtwXXDjxB7N8HaQ%3D%3D&trackingId=CLfS6PxZpRRQmZ6N2Wdn4Q%3D%3D&trk=public_jobs_jserp-result_search-card,"Entry-Level Data Analyst

Washington, DC




As an Entry-Level Data Analyst, you will play a crucial role in supporting data-driven initiatives. You will work closely with various teams to collect, analyze, and interpret data, helping to inform business decisions and strategies. This role is ideal for someone with a bachelor's degree and an internship experience in data analysis or reporting.




Key Responsibilities:

Collect, clean, and analyze data from multiple sources to support business objectives.
Generate reports and visualizations to communicate findings to stakeholders.
Assist in the development and maintenance of KPI dashboards and data models.
Collaborate with cross-functional teams to identify data needs and deliver actionable insights.
Support the ongoing improvement of data quality and processes.
Stay up-to-date with industry trends and best practices in data analysis.




Qualifications:

Bachelor’s degree in Data Science, Statistics, Mathematics, Economics, Computer Science, or a related field.
Internship experience in data analysis, reporting, or a related role.
Proficiency in data analysis tools and software (e.g., Excel, SQL, Python, R).
Experience with data visualization tools (e.g., Tableau, Power BI) is a plus.

Show more "
Data Analyst,Newrez LLC,2024-08-15,https://www.linkedin.com/jobs/view/data-analyst-at-newrez-llc-3984165539?position=1&pageNum=2&refId=l8pyJ7gBkvUo%2BD5SORDYMg%3D%3D&trackingId=ZgsnOxFlfMkoA86z0jkrug%3D%3D&trk=public_jobs_jserp-result_search-card,"Who We Are

Shellpoint Mortgage Servicing (SMS) is one of America’s top-five non-bank mortgage-servicing companies. What is mortgage servicing? Our clients are businesses that own mortgage loans (such as banks and real estate investment firms). On their behalf, we manage (or “service”) their loan portfolios, which means that we collect homeowners’ mortgage payments, pay their tax and insurance bills, and help homeowners in default to get current.

Position: Data Analyst

Job Location: NewRez LLC, Coppell, Texas

Job Duties

Maintain responsibility for designated group of operational departments or third-party clients by identifying and implementing new operational or client-based business strategies. Contribute to the creation, design, and implementation of value-add business strategies that affect current operating practices and company policy in team-oriented collaborative environments. Maintain responsibility for key operational risk-management metrics including investigating and coordinating the resolution of any operational issues that are discovered. Participate in projects designed to improve operational performance and deliver excellent client service while assisting internal operations units. Convey new ideas to performance managers and understanding potential obstacles to implementation. Perform query optimization and performance tuning. Clearly articulate and present ideas and findings to a varied audience including the operations staff and senior management. In connection with above duties, utilize experience in the following: Visualizing data in Tableau; SQL programming; Software, data analysis, and visualization skills, including Excel (graphs, pivot tables, formulas, statistical analysis), SQL, Tableau, and writing effective and efficient queries and meaningful visualization; Industrial knowledge, including origination side of the business; and Microsoft SQL Server and Microsoft SQL Server Management Studio.

Requires related degree, experience and skills. Part of employee referral program.

**

Company Perks


15 Paid Time Off (PTO) days and 18 after 1st anniversary!
9 Paid Holidays
Employee Engagement Activities


Company Benefits


Medical (including Health Savings Account & Flexible Savings Account)
Dental - RX – Vision – Life, Disability Insurance – 401(k) Plan with company match! – Employee Assistance Plan
Performance-based Incentives
Pet Insurance
Advancement Opportunities


Newrez NOW


Our Corporate Social Responsibility program, Newrez NOW, empowers employees to become leaders in their communities through a robust program that includes volunteering, philanthropy, nonprofit grants, and more
1 Volunteer Time Off (VTO) day, company-paid volunteer day where all eligible employees may participate in a volunteer event with a nonprofit of their choice
Employee Matching Gifts Program: We will match monetary employee donations to eligible non-profit organizations, dollar-for-dollar, up to $1,000 per employee
Newrez Grants Program: Newrez hosts a giving portal where we provide employees an abundance of resources to search for an opportunity to donate their time or monetary contributions


Equal Employment Opportunity

We're proud to be an equal opportunity employer- and celebrate our employees' differences, including race, color, religion, sex, sexual orientation, gender identity, national origin, age, disability, and Veteran status. Different makes us better.

CA Privacy Policy

CA Notice at Collection
Show more "
Data Analyst,Thrive Causemetics Inc.,2024-08-07,https://www.linkedin.com/jobs/view/data-analyst-at-thrive-causemetics-inc-3921362483?position=2&pageNum=2&refId=l8pyJ7gBkvUo%2BD5SORDYMg%3D%3D&trackingId=7MgRv%2B%2BFvKPPqxP1BlQz3A%3D%3D&trk=public_jobs_jserp-result_search-card,"Location: In Office 4 days/week in LA office

Who We Are:

Thrive Causemetics is Bigger Than Beauty™: We are an independent, female-owned beauty brand that creates high-performance vegan cosmetics and supports a community of giving. All of Thrive Causemetics' products are free of parabens and sulfates, in addition to being 100 percent cruelty-free. Through its Bigger Than Beauty™ program, every product you purchase results in a donation to help a woman thrive. Thrive Causemetics is dedicated to fostering a collaborative and cross-functional workplace where everyone’s voice matters. We are committed to being pioneers in creating a culture of wellness. Together, we prioritize a strong work ethic while maintaining a positive, exciting environment where people are passionate about what they do .

Who We Are Looking For:

The Data Analyst role at Thrive Causemetics is a hybrid role combining the skill sets of a data analyst, business intelligence analyst. You will work cross functionally with multiple departments, with a focus on growth marketing efforts (CRM, Search, Digital Marketing). This includes helping out with dashboard creation, data pipelines, inventory forecasting and other ad hoc data requests as needed.

What You Will Be Doing:


Apply creative problem-solving skills across various business domains, including marketing & demand planning, to address unique challenges
Leverage customer data analysis to refine and enhance marketing strategies for both e-commerce and brand marketing
Develop dashboards that blend data visualizations and tabular information, delivering real-time insights accessible to all departments
Daily / weekly / monthly KPI reporting for Marketing, Operations and Ecom
QA: Conduct quality assurance to ensure the accuracy of final reports and dashboards
Generate insights from marketing ad performance to improve our paid ad efficiency
Evaluate and improve current business processes related to data management by identifying opportunities for automation and streamlining
Translate data into easy-to-digest insights for non-analytical stakeholders
Fulfill ad hoc data requests and perform data queries as required


What Will Make You Stand Out:


Bachelor’s degree (or higher) in Mathematics, Statistics, Economics, Computer Science or related field
1+ year of SQL experience
1+ year of experience with Python for data analytics (pandas, sklearn, matplotlib, seaborn, plot.ly )
1+ year of experience with data visualization platforms (Tableau, Looker)


Thrive Causemetics is an Equal Opportunity Employer. Applicants must be authorized to work for any employer in the U.S. without current or future sponsorship for an immigration-related work benefit. Thrive Causemetics does not hire H-1B, F-1 CPT, OPT, or STEM OPT candidates for this role.

The base pay range for this role is $70,000 -$90,000, with the following factors determining the base pay at offer: skills, qualifications, experience. This range provides the opportunity to progress as you grow and develop within a role. Additionally, this role is also eligible for an annual discretionary bonus based on company and individual performance. Thrive Causemetics provides a competitive benefits package, including but not limited to: comprehensive medical, dental and vision plans, a 401(k) plan with employer matching, various paid time off programs, employee discount/perks, life insurance, disability insurance, and employee assistance programs.
Show more "
