title,company,date,link,description
Data Analyst,Thrive Causemetics Inc.,2024-08-07,https://www.linkedin.com/jobs/view/data-analyst-at-thrive-causemetics-inc-3921362483?position=21&pageNum=0&refId=WBUu%2B%2FY%2BtwXXDjxB7N8HaQ%3D%3D&trackingId=S1hoUUJcFGexE%2F7KjgX1yw%3D%3D&trk=public_jobs_jserp-result_search-card,"Location: In Office 4 days/week in LA office

Who We Are:

Thrive Causemetics is Bigger Than Beauty™: We are an independent, female-owned beauty brand that creates high-performance vegan cosmetics and supports a community of giving. All of Thrive Causemetics' products are free of parabens and sulfates, in addition to being 100 percent cruelty-free. Through its Bigger Than Beauty™ program, every product you purchase results in a donation to help a woman thrive. Thrive Causemetics is dedicated to fostering a collaborative and cross-functional workplace where everyone’s voice matters. We are committed to being pioneers in creating a culture of wellness. Together, we prioritize a strong work ethic while maintaining a positive, exciting environment where people are passionate about what they do .

Who We Are Looking For:

The Data Analyst role at Thrive Causemetics is a hybrid role combining the skill sets of a data analyst, business intelligence analyst. You will work cross functionally with multiple departments, with a focus on growth marketing efforts (CRM, Search, Digital Marketing). This includes helping out with dashboard creation, data pipelines, inventory forecasting and other ad hoc data requests as needed.

What You Will Be Doing:


Apply creative problem-solving skills across various business domains, including marketing & demand planning, to address unique challenges
Leverage customer data analysis to refine and enhance marketing strategies for both e-commerce and brand marketing
Develop dashboards that blend data visualizations and tabular information, delivering real-time insights accessible to all departments
Daily / weekly / monthly KPI reporting for Marketing, Operations and Ecom
QA: Conduct quality assurance to ensure the accuracy of final reports and dashboards
Generate insights from marketing ad performance to improve our paid ad efficiency
Evaluate and improve current business processes related to data management by identifying opportunities for automation and streamlining
Translate data into easy-to-digest insights for non-analytical stakeholders
Fulfill ad hoc data requests and perform data queries as required


What Will Make You Stand Out:


Bachelor’s degree (or higher) in Mathematics, Statistics, Economics, Computer Science or related field
1+ year of SQL experience
1+ year of experience with Python for data analytics (pandas, sklearn, matplotlib, seaborn, plot.ly )
1+ year of experience with data visualization platforms (Tableau, Looker)


Thrive Causemetics is an Equal Opportunity Employer. Applicants must be authorized to work for any employer in the U.S. without current or future sponsorship for an immigration-related work benefit. Thrive Causemetics does not hire H-1B, F-1 CPT, OPT, or STEM OPT candidates for this role.

The base pay range for this role is $70,000 -$90,000, with the following factors determining the base pay at offer: skills, qualifications, experience. This range provides the opportunity to progress as you grow and develop within a role. Additionally, this role is also eligible for an annual discretionary bonus based on company and individual performance. Thrive Causemetics provides a competitive benefits package, including but not limited to: comprehensive medical, dental and vision plans, a 401(k) plan with employer matching, various paid time off programs, employee discount/perks, life insurance, disability insurance, and employee assistance programs.
Show more "
Data Analyst,Quest Financial,2024-08-16,https://www.linkedin.com/jobs/view/data-analyst-at-quest-financial-4000230299?position=22&pageNum=0&refId=WBUu%2B%2FY%2BtwXXDjxB7N8HaQ%3D%3D&trackingId=I5poWt4cA4Gb1MJJJbVudQ%3D%3D&trk=public_jobs_jserp-result_search-card,"We are seeking recent graduates with an interest in building a career in Data Analytics for a Data Analytics Coordinator opening in the Perimeter area.




Highlights:

Position will work on the Data Analytics team of a global logistics company
This is a hybrid remote position with 2 WFH days/week of the candidates choosingBase salary from 50-55k + bonus ranging from 6%-24% of salary. Pay reviews every 6 months.
Excellent benefits package- company pays 85% of employees’ healthcare costs, 6% 401k match, and other great benefits




Description:

As the Data Analytics Coordinator, you will Partner with key stakeholders to establish and implement data-driven metrics designed to improve internal business processes, support strategic planning, and ultimately improve profitability. In addition, the role will laisse with central departments to progress the organizations goals for digitalization and automation.




Responsibilities:

Leverages the use of data analytics tools (e.g. QlikSense, Databricks, Snowflake, Python, Alteryx, etc.) to implement solutions, and to increase team’s efficiency and reliability.
Manage and oversees cross-functional data analytics projects across departments, guiding them from inception through production while ensuring adherence to quality standards and deadlines.
Collaborate in defining metrics to expand depth of analysis, to improve internal processes and uncover quantifiable business opportunities.
Design, develop and maintain scalable data products for data warehousing (Data Lake concept).
Cultivate trust and cooperation with stakeholders, fostering a collaborative environment that promotes knowledge sharing.
Clearly convey findings and insights to upper management and internal stakeholders to support strategic decision-making.
Provide guidance and training to peers or stakeholders on data analytics tools and best practices.
Continuously update knowledge on the latest data analytics technologies and trends to ensure the application of cutting-edge tools and methodologies.




Requirements:

Bachelor’s degree in Information Systems, Data Analytics, Business Intelligence, or related field.
Interest in data visualization tools (e.g., QlikView, QlikSense, Tableau, Power BI) to create impactful, easy-to-understand visual reports.
Interest in ETL processes using tools like Databricks, Snowflake, Alteryx, or similar platforms.
Preferred experience with programming languages such as SQL, Python, among others.













Alternate job titles: Data Specialist, Data Coordinator, Entry-Level Data Analyst, Financial Analyst, Operations Analyst, Systems Analyst

Show more "
Data Analyst,"Softworld, a Kelly Company",2024-07-26,https://www.linkedin.com/jobs/view/data-analyst-at-softworld-a-kelly-company-3984593098?position=24&pageNum=0&refId=WBUu%2B%2FY%2BtwXXDjxB7N8HaQ%3D%3D&trackingId=bb9AkjHpDHenFT37ZtBQWg%3D%3D&trk=public_jobs_jserp-result_search-card,"Job Title: Data Analyst

Job Location: Savannah GA 31406

Onsite Requirements:

Running SQL queries to pull data from Snowflake
Build reporting from data using Qlik
Strong understanding of business metrics/KPIs

Job Description:

Essential Functions / Duties Performed Regularly:

Analyze and interpret data from various marketing campaigns to uncover trends, patterns, and insights related to performance and identify areas for improvement.
Monitor and evaluate call center metrics, such as call volumes, service levels, customer satisfaction, and resolution times.
Develop and maintain dashboards and reports that track key performance indicators (KPIs) and marketing effectiveness.
Collaborate with marketing teams to design and implement A/B testing frameworks and measure the impact of various campaigns.
Provide data-driven recommendations to optimize marketing spend and improve return on investment (ROI).
Work with customer service managers to improve call center operations and customer engagement strategies.
Utilize advanced analytics techniques to forecast trends and model potential outcomes of marketing and customer service initiatives.
Stay abreast of industry trends and advancements in analytics and performance marketing tools.

Minimum Qualifications:

Education: Bachelor's degree in Statistics, Mathematics, Economics, Computer Science, or related field or equivalent combination of education and experience.
Work Experience: Minimum of 5 years of experience in a data analysis role, preferably within a marketing or advertising context.

Knowledge, Skills and Abilities:

Analytical Skills: Ability to interpret complex data sets and provide actionable insights.
Statistical Knowledge: Proficiency in statistical tests, distributions, and regression analysis.
Data Visualization: Skill in creating clear visual representations of data using tools like Tableau or Power BI.
SQL: Strong command of SQL for querying databases.
Programming Languages: Proficiency in programming languages - SQL, Python, R, or other data analysis tools.
Machine Learning: Understanding of basic machine learning algorithms and their application in marketing data.
A/B Testing: Experience in designing and interpreting A/B tests to optimize campaign performance.
Data Mining: Ability to extract data from various sources and prepare it for analysis
Strong communication skills: Ability to translate complex data into actionable insights for non-technical stakeholders.

Physical Requirements:

Standing, walking, sitting, movement and use of mechanical controls, such as keyboard, are frequently required.

** 3rd party and subcontract staffing agencies are not eligible for partnership on this position. 3rd party subcontractors need not apply.

This position requires candidates to be eligible to work in the United States, directly for an employer, without sponsorship now or anytime in the future **

Show more "
Data Analyst (Business Intelligence),Inceed,2024-08-15,https://www.linkedin.com/jobs/view/data-analyst-business-intelligence-at-inceed-4000766628?position=28&pageNum=0&refId=WBUu%2B%2FY%2BtwXXDjxB7N8HaQ%3D%3D&trackingId=mdgQj6D5CC3rtsUdnQWNMw%3D%3D&trk=public_jobs_jserp-result_search-card,"Compensation: $90K $110K + annual bonus (15%)

Location: Midland, TX

Data Analyst (Business Intelligence)

Inceed has partnered with a rapidly growing energy company to help find a skilled Data Analyst to join their team!

In this role, you will help optimize, update and maintain Spotfire reports and dashboards. You will join an inclusive and collaborative team to analyze datasets to help with KPIs and benchmarking.

Responsibilities:


Collaborate with business units to develop reports and dashboards
Create and Manage Business Intelligence reports
Train the users of the reports on the use and functionality of the tool
Work on multiple projects in a fast paced environment


Required Qualifications & Experience:


Expert in Spotfire
Dashboards and reporting
Have a few data science projects (with Python and R scripts)
Industry (Oil & Gas) knowledge
Understand KPIs


Nice to Have Skills & Experience:


PowerBI
Python or SQL


Perks & Benefits:


Annual bonus (up to 15%)
Generous relocation package
Join a rapidly growing company
Join an inclusive and collaborative team


If you are interested in learning more about the Data Analyst opportunity, please submit your resume for consideration. Our client is unable to provide sponsorship at this time.

We are Inceed, a staffing and direct placement firm who believes in the possibility of something better. Our mission is simple: We’re here to help every person, whether client, candidate, or employee, find and secure what’s better for them.

Inceed is an equal opportunity employer. Inceed prohibits discrimination and harassment of any type and affords equal employment opportunities to employees and applicants without regard to race, color, religion, sex, sexual orientation, gender identity or expression, pregnancy, age, national origin, disability status, genetic information, protected veteran status, or any other characteristic protected by law.


Show more "
Data Analyst,EnableComp,2024-07-23,https://www.linkedin.com/jobs/view/data-analyst-at-enablecomp-3991446700?position=29&pageNum=0&refId=WBUu%2B%2FY%2BtwXXDjxB7N8HaQ%3D%3D&trackingId=wfnGu%2BSKDm%2B0904ENyc%2BtQ%3D%3D&trk=public_jobs_jserp-result_search-card,"Recognized as a 2024 Top Workplace by the Tennessean, EnableComp is the leading source of revenue cycle management solutions for complex claims in the US. We proudly partner with well over 1000+ hospitals across the US to help them maximize their revenue from complex claims.

Our Mission

We partner with healthcare providers to maximize reimbursement from complex claims payers by having the best people, processes, products and performance.

Our Vision

We enable healthcare providers to do what they do best.

Position Summary

The Data Analyst responsibilities will include but not limited to quantitative analysis and predictive modeling of healthcare data to provide management with statistical findings and conclusions.  The ideal candidate should be able to develop, collect and analyze metrics and data to formulate fact-based decisions and proactively implement process improvements through analysis of claim and operational data.




Key Responsibilities
Ability to transform complex datasets into executive-level summaries, and communicate findings clearly and succinctly
Managing multiple projects and deadlines so you will need excellent time management and prioritization skills to meet multiple deadlines
Demonstrated problem solving and critical thinking skills; strong understanding of analytics results, as well as the ability to identify a problem and develop and execute new solutions to obtain results
Effectively communicate results to key stakeholders and policy makers; communication of results include clean and well-organized presentations to reflect analytic methods used and to illustrate key decision points with sufficient detail to support comprehension and replication of the analysis
Data responsibilities include identifying necessary data elements to build measures, querying data to limit large data sets, joining tables to build analytic views, other data prep, and documentation of process and results; working with external data management team to receive, load, and analyze new data
Ability to communicate with BA and IT to understand requirements, socialize ideas among peers and document work product
Solid hands-on experience and knowledge of database concepts
Ability to work independently given minimal direction
Exceptional attention to detail and work product validation, as well as the ability to step back and see the big picture
Other duties as required




Requirements and Qualifications
Bachelor’s Degree
2+ years’ experience with analytics, reporting, and relational databases
2 years’ experience working in a healthcare, SaaS or other similar environment.
Expertise in Microsoft Excel, PowerPoint, and SQL Server
Familiarity with healthcare terminology such as diagnosis code, CPT, claim ID, DRG, inpatient, outpatient, etc.
Experience with BI tool (Power BI/Tableau/Qlik)
Experience with statistical models and predictive analytics
Equivalent combination of education and experience will be considered.
Must have strong computer proficiency and understand how to use basic office applications, including MS Office (Word, Excel, and Outlook).
Regular and predictable attendance.
To perform this job successfully, an individual must be able to perform each essential duty satisfactorily.  Reasonable accommodations may be made to enable qualified individuals with disabilities to perform the essential functions.




Special Considerations and Prerequisites
Strong communication and presentation skills; ability to explain complex analytic results to an audience of varying levels of technical understanding required
Exceptional attention to detail and work product validation
Strong planning, organizational, and multi-tasking skills
Strong research, analytical, and problem-solving skills
Strong communication skills, written and verbal
Ownership of body of work







EnableComp is an Equal Opportunity Employer M/F/D/V. All applicants will be considered for this position based upon experience and knowledge, without regard to race, color, religion, national origin, sexual orientation, ancestry, marital, disabled or veteran status. We are committed to creating and maintaining a workforce environment that is free from any form of discrimination or harassment.

EnableComp recruits, develops and retains the industry's top talent.  As the employer of choice in the complex claims industry, EnableComp takes pride in our continuous commitment to building and maintaining a culture centered around fostering the professional growth and development of our people.  We believe that investing in our employees is the key to our success, and we are dedicated to providing them with the tools, resources, and support they need to thrive and grow their career here. At EnableComp, we are committed to living up to our core values each and every day, and we believe that this commitment is what sets us apart from other companies.  If you are looking for a company that values its employees and is dedicated to helping them achieve their full potential, then EnableComp is the place for you.

 Don’t just take our word for it!  Hear what our people are saying:

“I love my job because everyone shares the same vision and is determined and dedicated. People care about you as a person and your professional growth. There is a genuine spirit of cooperation and shared goals all revolving around helping each other.” – Revenue Specialist

“I enjoy working for EnableComp because of the Core Values we believe in. EnableComp stands true to these values from empowering employees to ecstatic clients. This company is family oriented and flexible, along with understanding the balance of work, life, and fun.” – Supervisor, Operations

Show more "
Data Analyst,Point72,2024-08-06,https://www.linkedin.com/jobs/view/data-analyst-at-point72-3994760012?position=30&pageNum=0&refId=WBUu%2B%2FY%2BtwXXDjxB7N8HaQ%3D%3D&trackingId=6JJ7yHdvdaF7yFuitOibSg%3D%3D&trk=public_jobs_jserp-result_search-card,"Role

We are passionate about data. We collaborate to build elegant, effective, scalable and highly reliable solutions to empower predictive modelling in finance.

Cubist’s data services group is looking for a Data Analyst to join our dedicated team. Our group is responsible for the timely delivery of comprehensive and error-free data to some of the most demanding and successful systematic Portfolio Managers in the world.

This exceptional individual will be a member of a small team of Data Scientists/Analysts who play a vital role in ensuring the smooth day-to-day implementation of a large research infrastructure, and the live production trading of billions of dollars of capital across global capital markets, including equities, futures, options and other financial instruments.

Responsibilities


Identifying potential data sources
Coordinate with compliance team and legal team on new vendor trial/subscription process
Assist with collecting and maintaining overviews and vendor content offering
Assist with data questions and requests from investment teams
Setting up feed download and monitor check in database
Monitoring the automated data collection and cleansing infrastructure
Coordinating meetings and conference calls between data users and experts.
Assist in organizing presentations
Handle user requests and answer questions about data
Download trial datasets from vendor FTP sites or other delivery mechanism
Assist Data Team with manual data processing as required
Maintain Cubist Data Wiki contents


Requirements


Basic level programming experience in Python and SQL. Experience with AWS and Airflow preferred but not required
Financial industry experience preferred but not required
Strong organization, communication and interpersonal skills
Attention to detail and a love of process
Strong oral and written communication skills
Ability to exercise sound judgment in assessing and determining how to handle queries, calls and issues
Ability to multitask and prioritize assignments


The annual base salary range for this role is $100,000-$150,000 (USD) , which does not include discretionary bonus compensation or our comprehensive benefits package. Actual compensation offered to the successful candidate may vary from posted hiring range based upon geographic location, work experience, education, and/or skill level, among other things.
Show more "
Junior Data Analyst,Brooksource,2024-08-12,https://www.linkedin.com/jobs/view/junior-data-analyst-at-brooksource-3996487185?position=32&pageNum=0&refId=WBUu%2B%2FY%2BtwXXDjxB7N8HaQ%3D%3D&trackingId=IxGKONOzgVRK%2BNroB7neqQ%3D%3D&trk=public_jobs_jserp-result_search-card,"Associate Data Analyst

Rolling contract through EOY

Downtown Denver (onsite 2 days a week)

$35/hr




Project Overview:

We are seeking a Data Analyst to support city agencies with their Power BI needs, including training, report development, and troubleshooting technical issues. The ideal candidate should have strong expertise in Power BI and experience in helping others use the tool effectively. Requests are managed through ServiceNow, with tasks assigned individually.




While experience in the public sector is a plus, it is not required. The Power BI Analyst must be comfortable working with individuals at all levels of the organization, from senior management to end-users. The analyst will interact with customers who have varying levels of expertise and will work on reports with different levels of complexity.




Team:

You will be working closely with the lead and manager over the analytics team. They will guide your day to day tasks and handle questions you have.




Day to Day:

Collaborate with Senior BI & Data Analyst FTE to effectively manage workload and troubleshoot technical issues.
Create standard documentation for recurring requests and resolution of Power BI issues.
Make suggestions for any as-is or to-be processes which are lacking and/or present a risk and help mitigate them, before they become an issue.
Follow TS best practices, including: documentation, project, and change management processes
Creating process and system diagrams for current and future system and process documentation
Delivering documentation converted for training or making course materials for end users
Excellent team collaboration, delivering results with peers, customers, and vendors




Requirements:

4 year CS degree
0-1 year of experience with PowerBI
Some experience with visualization tools
Any exposure to Snowflake is a huge plus




Eight Eleven Group (Brooksource) provides equal employment opportunities (EEO) to all employees and applicants for employment without regard to race, color, religion, national origin, age, sex, citizenship, disability, genetic information, sexual orientation, gender identity, marital status, amnesty or status as a covered veteran in accordance with applicable federal, state, and local laws.

Show more "
